{
  "engine_release": "0.6.1",
  "packages": {
    "audit-library": "0.3.0",
    "core": "0.6.1",
    "dependency-discipline": "0.1.0",
    "design-review": "0.2.0",
    "external-contribution": "0.1.0",
    "github-projects-sync": "0.3.0",
    "memory-semantic-recall": "0.1.0",
    "memory-substrate-sqlite-fts5": "0.2.0",
    "migration-discipline": "0.1.0",
    "product-design": "0.2.0",
    "qa-review": "0.2.0",
    "routine-mode": "0.2.0",
    "validators-core": "0.3.0"
  },
  "identity": "solo",
  "home_repository": "StarshipSuperjam/engine-template",
  "min_upgradeable_from": "0.3.2"
}
